{
  "id": "FUNC-045",
  "type": "function",
  "title": "Construct lossless candidates from explicit record edits",
  "status": "draft",
  "description": "Actors can supply a bounded meaningful engineering task and see exactly its intended candidate effects without hidden semantic changes. This logical behavior has the scope and limits of SR-043; current SQLite realization and maintenance remain distinct.",
  "inputs": [
    "Explicit supported operation, selected project/Change and expected coherent state.",
    "Actor-supplied candidate or verified recovery basis, with declared subject and artifact identities."
  ],
  "preconditions": [],
  "outputs": [
    "Exact attributable result or explicit conflict, unavailability, rejection or recovery-required outcome."
  ],
  "behavior": [
    "The actor supplies required semantic inputs; the tool constructs identities and storage bookkeeping without requiring directories, manifests or database fields from callers.",
    "Only explicitly selected values and necessary metadata change. Omitted fields and unrelated records remain unchanged. Explicit replacement of comparable working information is permitted; attachments still supporting retained conclusions cannot silently change meaning.",
    "A task submission constructs one coherent candidate containing its related facts. Same-request references resolve before publication; conflicting assignments reject. This does not require a public arbitrary batch interface.",
    "Current evidence and assessment accounts may be replaced through their owning tasks without permanent predecessor chains. Retain open findings until explicit disposition, the attribution and basis of judgments still relied upon, and compact completed accounts. Progress updates cannot create reviewer judgments or widen authority.",
    "Preview validates the same intended semantic candidate without authoritative writes, persistent reservations or a saved claim. Execution checks freshness again and does not treat preview as authority.",
    "Unavailable known records or occupied destinations cannot be treated as empty creation targets. Explicit restoration remains subject to its own supported operation and normal integrity, authority and conflict checks."
  ],
  "failure_behavior": [
    {
      "condition": "The requested candidate, expected state or recovery basis cannot be established safely.",
      "outcome": "Return the corresponding bounded rejection, conflict or recovery condition without invented decisions, silent merge or unrelated overwrite."
    }
  ],
  "sources": [
    {
      "source": "SRC-PUBLISHED-CLI",
      "locator": "docs/design/cli/cli.md#CLI-SR-03, CLI-SR-12, CLI-SR-13, CLI-SR-15, CLI-SR-16, CLI-SR-25, CLI-SR-26; docs/design/cli/records.md#RF-SR-08, RF-SR-10, RF-SR-13",
      "basis": "Functional Analysis of the IR-008 system obligations confirms this distinct published command/record responsibility. The retained CLI/Record Format contract supplies exact public operations and limits; logical behavior is defined before Module allocation."
    },
    {
      "source": "SRC-PUBLISHED-PRODUCTS",
      "locator": "FUNC-045",
      "basis": "Assign MOD-011 as the proposed accountable primary responsibility after Functional Analysis. Current product source contracts retain detailed behavior authority; allocation is not runtime adoption or complete AR coverage."
    },
    {
      "source": "SRC-LOCAL-OPERATIONAL-ANALYSIS",
      "locator": "FUNC-045",
      "basis": "Draft derivation from the refined IRs and RR proposal; no approval, implementation or satisfaction claim."
    },
    {
      "source": "SRC-WORKFLOW-CONTRACTS",
      "locator": "FUNC-045",
      "basis": "Reconcile the refined existing requirement with successor workflow recording while keeping attributed observed v3 realization unchanged."
    },
    {
      "source": "SRC-CURRENT-HANDOFF",
      "locator": "FUNC-045",
      "basis": "User-selected current handoff and selective retention refinement. Reuse existing identity and responsibility; no runtime adoption or independent approval is asserted."
    }
  ],
  "allocated_to": "MOD-011"
}
