{
  "id": "FUNC-041",
  "type": "function",
  "title": "Discover current recorded changes without selecting authority",
  "status": "draft",
  "description": "Inspect bounded project-local locations and classify current change candidates using the declared structural rules. Return placement and selection facts, never a next activity, archival judgment, implicit change selection, or recovery action.",
  "inputs": [
    "Project context and validated placement configuration.",
    "An optional explicit change selection or a bounded discovery request."
  ],
  "preconditions": [],
  "outputs": [
    "Explicit selection, safe configured locations, coherent current candidate identities/contracts/revisions, and classification counts.",
    "Scope/completeness and safe diagnostics for malformed, ambiguous, interrupted, unsupported, or inaccessible input."
  ],
  "behavior": [
    "Apply current/archive classification without operationally interpreting historical lifecycle data or deriving registry authority from arbitrary files.",
    "Distinguish coherent v3, bounded recognized archives, both-manifest ambiguity, unknown headers, reserved current residue, interrupted transaction attention, unrelated directories, and absence.",
    "Honor an explicit selection without enumerating unrelated candidates; otherwise inspect only the bounded declared discovery scope and order returned candidates deterministically.",
    "Report each candidate's observed revision and contract as factual context requiring fresh checks before mutation, not an atomic cross-change snapshot.",
    "Keep configuration provenance and path-placement facts separate from writable authority and reject retired spec/unknown configuration kinds before discovery."
  ],
  "failure_behavior": [
    {
      "condition": "A current candidate is malformed, mixed, ambiguous, unsafe, or interrupted.",
      "outcome": "Return the applicable explicit diagnostic and incomplete scope rather than silently excluding it as archived."
    },
    {
      "condition": "Enumeration, candidate-count, or result bounds prevent complete discovery.",
      "outcome": "Report the bounded failure with complete=false rather than truncate silently or choose the first candidate."
    }
  ],
  "sources": [
    {
      "source": "SRC-PUBLISHED-CLI",
      "locator": "docs/design/cli/cli.md#CLI-SR-23, CLI-SR-28, CLI-SR-32",
      "basis": "Functional Analysis of the IR-008 system obligations confirms this distinct published command/record responsibility. The retained CLI/Record Format contract supplies exact public operations and limits; logical behavior is defined before Module allocation."
    },
    {
      "source": "SRC-PUBLISHED-PRODUCTS",
      "locator": "FUNC-041",
      "basis": "Assign MOD-010 as the proposed accountable primary responsibility after Functional Analysis. Current product source contracts retain detailed behavior authority; allocation is not runtime adoption or complete AR coverage."
    }
  ],
  "allocated_to": "MOD-010"
}
